,словесное_описание_модели,беспредложное,предложное,слова
205,"
 
на что", , ," абонемент, абонироваться, аванс, акт, акцент, алчный, аннотация, аппетит, арест,
базироваться, бедный, богатый, ведомость, вешать, возразить, выписать, годиться, годный,
горазд, готовиться, готовый, дерзать, дивиться, договор, дублированный, жадность, жадный,
жить, запереть, запрещение, заявление, идти2, использовать, конкурс, купить, ленивый,
лихой, манить, мастер, материал, мобилизация, мобилизовать, монополия, мораторий,
навести, нависнуть, надеяться, наздравствоваться, напроситься, настроиться, нацелиться,
невзыскательный, невоздержанный, негодный, неистощимый, необходимый, неспособный,
неудачливый, нужный, обидеться, облокотиться, обречь, ориентировать, осмелиться,
осужденный, ответить, отзыв, отзывчивый, отложить, охотник, охочий, падкий, пародия,
пенять, поддаваться, подписка, подстрекать, подходящий, покупатель, претендент,
претендовать, претензия, пригодиться, призвать, притязать, проглядеть, раздражаться,
разохотиться, рассердиться, рекомендовать, рецензия, роптать, свести, сетовать, скидка,
склонить, склониться, смеяться, соблазниться, согласиться, согласный, соревноваться,
способность, способный, стандарт, талант, толкать, требование, тугой, тянуть2, ударение,
указание, указать, улыбнуться, упереться, упор, успеть, цена, чуткий, щедрый"
206,"
 
чем", ins, ," баловаться, бахвалиться, бедный, богатый, болеть, бравировать, бредить, бросать,
брызгать, будоражить, варьировать, ведать, велик, вертеть, вершить, виноват, воздать,
восторгаться, вращать, встряхнуть, глубокий, гнушаться, грешить, грозный, датировать,
двигать, дергать, диспонировать, жалкий, жертвовать, жить, заведующий, завтракать,
завязать, загребать, загрузить, закусить, закутаться, запереть, запустить, заражение,
заслушаться, знаменательный, играть, идти1, идти4, изобильный, изойти, изумленный,
исполненный, исчислить, исчисляться, качать, кидать, командование, командовать,
командующий, контрабанда, кончить, кончиться, корить, косить, крутить, курить, лепить,
манить, манкировать, метать, мотать, наесться, напутствовать, начать, небогатый, небречь,
неглижировать, обернуть, обиловать, облечь1, облечь2, обрадованный, обуревать,
объесться, огорчен, одержимость, одержимый, озабоченность, оперировать, оскорбиться,
ответить, отдавать, отдарить, отделаться, отличаться, отозваться, перебирать, перемежать,
перемежаться, плескать, покосить, покрутить, попрекнуть, поражаться, потрясти, потчевать,
пошвырять, преисполненный, преисполнить, преисполниться, премировать, пренебрежение,
преследовать, пресытиться, приметный, промышлять, развевать, раздражаться, разжиться,
различаться, разойтись, располагать, рассерженный, риск, руководитель, руководство,
связать, сильный, симпатичный, служить, соблазниться, совпасть, сойтись, страдать,
страшный, счастливый, сыпать, торг, торговать, трогательный, трудить, трясти, удар,
удивлен, удовлетворить, удостоить, ужинать, укутать, управление, управляющий, хороший,
швырять, шевелить"
207,"
  
чего", gen, ," абонент, авария, аккомпанемент, акт, аннотация, антология, аукцион, благо, вблизи,
ведомость, венец, взаимосвязь, взыскующий, взять, виртуоз, вкусить, властелин, влить,
вместилище, возможность, воспоминание, враг, всыпать, вывалить, выжидать, выпить,
выпросить, выслать, гарантия, глава, дать, держаться, добавить, добрать, добыть, догрузить,
додать, дожидаться, дознаться, доискиваться, доказательство, докупить, долить, доложить2,
дорога, доставить, достать1, достать2, достигнуть, досыпать, дым, жажда, жаждать, жалеть,
жалко, ждать, желать, заглотнуть, задать1, задать2, закон, занять, запасти, запрещение,
запросить, запутанность, заражение, заслуживать, заслушаться, засыпать, захватить,
зачерпнуть, идея, избегать, изволить, изготовить, изменение, инициатива, искать, испечь,
испить, исполненный, исследование, карикатура, катастрофа, командование, комбинация,
компенсация, конец, контрабанда, контраст, контроль, копия, купить, мастер, мера, меры,
монополия, набавить, набелить, набить, наболтать1, наболтать2, набормотать, наборонить,
набрать, набронзировать, набросать, набрызгать, навалить, навалять, наварить, навезти,
навертеть, навешать1, навешать2, навить, навозить, наволочь, наворовать, наворожить,
наворотить, наворочать, наворошить, навыдумать, навязать, навялить, нагатить, нагладить,
наглушить, наглянцевать, нагнать1, нагнать2, нагнать3, нагнать4, наговорить, нагородить,
наготовить, нагофрировать, награбить, награвировать, награнить, награфить, нагрести,
нагромоздить, нагрызть, нагулять, надавать, надарить, надбавить, наддать, наделать,
надергать, надоить, надолбить, надрать, надубить, надуть, наесться, нажарить, нажать1,
нажать2, нажечь, нажить, назанимать, наиграть, наискаться, накапать, накатать, накатить,
накачать, наквасить, накидать, накипятить, наклеить2, наклепать, наковать, накоксовать,
наколдовать, наколотить, наколоть, наколупать, накомкать, накопать1, накопить,
накоптить, накорчевать, накосить, накрасить, накрасть, накрахмалить, накроить, накропать,
накрошить, накрутить, накупить, накурить, накусать, накутать, налакировать, налепить,
налетать, налиновать, налитографировать, налить, наложить1, наломать, налощить,
налудить, налузгать, налущить, наляпать, намазать, намазюкать, намарать, намариновать,
намежевать, намельчить, наменять, намерить, намесить, намести, наметать, намешать,
намолотить, намолоть, наморозить, намочить, намыть, намять, нанести, нанизать, наносить,
наобещать, наострить, наоткрывать, напарить, напасти, напастись, напахать, напаять,
напеть, напечь, напилить, напихать, наплавить, наплескать, наплести, наплющить,
наполировать, наполоскать, наполосовать, наполоть, напороть, напортить, наприниматься,
напророчить, напроситься, напрыскать, напрясть, напутать, наработать, нарассказать,
нарастить, нарвать, нарезать, нарубать, нарубить, нарыть1, нарыть2, насадить1, насбивать,
насверлить, насечь, насеять, насинить, насказать, наскоблить, наскрести, наслать, наслоить,
насмолить, наснимать, насобирать, насовать, насоветовать, насоздавать, насолить,
насортировать, насосать, насочинить, наставить, настегать, настелить, настирать, настлать,
настричь, настрогать, настроить, настрочить, настругать, настряпать, настукать, насудачить,
насулить, насучить, насушить, насшибать, насыпать, натаскать, натащить, натаять,
натворить1, натворить2, натеребить, натереть, натесать, натискать, наткать, натолкать,
натолочь, натомить, натопить, наторговать, наточить1, наточить2, натратить, натрепать,
натрещать, натрусить, натрясти, натушить, натыкать, наудить, наутюжить, нафабриковать,
нафантазировать, нафаршировать, наформовать, нахапать, нахватать, нацедить, начеканить,
начерпать, начертить, начесать, начинить1, начиркать, начистить, нашвырять, нашелушить,
нашептать, нашинковать, нашить, нашпиговать, наштамповать, наштопать, нащелкать,
нащепать, нащипать, наэкономить, невзвидеть, недобрать, недовесить, недовыработать,
недовыручить, недовязать, недоглядеть, недоговорить, недогрузить, недодать, недоделать,
недоедать, недожарить, недожать1, недолить, недомерить, недомолотить, недомолоть,
недооценить, недопаять, недопечь, недоплатить, недополучить, недосеять, недосказать,
недослать, недослышать, недосмотреть, недосолить, недосы’пать, недоучесть, независимость,
необходимость, несамостоятельность, несообразность, несоответствие, несостоятельность,
неумеренность, обход, объесться, объявление, объяснение, одобрение, одолжить, ожидать,
опись, оплата, опыт, остатки, отбавить, отведать, отвезти, отвесить, ответственность,
откусить, отлить, отнести, отпить, отплеснуть, отрезать, отрубить, отсосать, отсрочка,
отсыпать, отхлебнуть, отцедить, отчерпнуть, очевидец, очерк, патриот, перебрать,
передарить, передать1, переесть, перекусить, перекушать, переложить, перепить, пересыпать,
перехватить, плеснуть, подать, подбавить, подбросить2, подвалить, подварить, подвезти,
подготовка, подгрузить, поддать, поджарить, поджидать, подзаработать, подкинуть,
подклеить, подколоть, подкопить, подкупить, подлить, подложить, подмесить, подмешать,
подмотать, поднакопить, поднести, подождать, подпустить, подрезать, подрубить, подрыть,
подсадить, подсеять, подсыпать, подтверждение, подтолочь, подтопить, поесть, пожевать,
позаимствовать, поискать, поклевать, поколоть, покрошить, покупатель, покушать,
понабрать, понабросать, понавезти, понавести, понавешать1, понавешать2, понавозить,
понавязать, понагнать, понагородить, понадавать, понаделать, понакидать, понаклеить,
понанести, понапихать, понаснимать, понасобирать, понасовать, понаставить, понастроить,
понатаскать, понатыкать, понахватать, понашить, понаштопать, попробовать, попросить,
попытать, порезать, порубить, посбавить, посбирать, посбить, посолить, постоянство,
посушить, посы’пать, потеря, потребность, похлебать, почерпать, почерпнуть, правда,
предпосылка, преемственность, презрение, преисполненный, преисполниться, прелюдия,
прибавить, приболтать, прибросить, приварить, привезти, привесить2, приволочь,
приготовить2, пригубить, придать, придерживаться, призанять, признание, прикинуть,
прикопить, прикупить, прилить, пример, примесить, примешать, примотать, принакопить,
принести, принять, припасти, прирезать, присадить, присеять, прислать, присыпать,
притащить, прихватить, причина, пролог, промыслить, просить, противник, процент,
прятаться, путь, раздобыть, разжиться, реестр, рекорд, решение, риск, роспись,
руководитель, руководство, самостоятельность, сварить, свидетель, свидетельство, связь,
сигнал, след, смотр, собрать1, совеститься, сообщение, соотношение, спрашивать, спросить,
стандарт, стимул, стоить, страх, счет, тенденция, требование, требовать, убавить, удар,
удовольствие, удостоить, улучшение, управление, условие, участник, учет, факт, фрагмент,
хватить, хлебнуть, хозяин, хотеть, цена, часть, чаять, черпнуть, чуждый, шум, эпилог,
ясность"
