,словесное_описание_модели,беспредложное,предложное,слова
208,"
 
что", acc, ," абстрагировать, акклиматизировать, бактеризовать, баррикадировать, болтать,
брикетировать, бросать, брызгать, варьировать, ведать, вертеть, вершить, взять, вкусить,
влить, возвестить, воздать, восстановить, вотировать, вращать, вспомнить, встряхнуть,
всыпать, вывалить, выжидать, выпить, выпросить, выслать, гладить, глодать, говорить,
горбить, гравировать, датировать, дать, двигать, декларировать, денонсировать,
депонировать, дергать, дискутировать, дистиллировать, дифференцировать, добавить,
добрать, добыть, доверять, догрузить, додать, дозволить, дозировать, доказать, докупить,
долить, доложить1, доложить2, доставить, достать2, досыпать, драматизировать, думать,
жалеть, жертвовать, забаррикадировать, забыть, заверить, завязать, заглотнуть, загребать,
загрузить, задать1, задать2, задеть, замедлить, занять, запамятовать, запасти, заплатить,
заповедать, запросить, запустить, заслужить, засыпать, затоварить, захватить, зацепить,
зачерпнуть, заявить, знаменовать, знать, изведать, изготовить, импровизировать,
инструментовать, инсценировать, интегрировать, интенсифицировать, искать, исключая,
испечь, испить, испросить, кидать, ковырять, кодировать, кончить, косить, крутить, купить,
курить, леденить, лепетать, лепить, лить, лузгать, лущить, маркировать, матрицировать,
межевать, мездрить, мельчить, метать, молнировать, мыслить, набавить, набелить, набить,
наболтать1, наболтать2, набормотать, наборонить, набрать, набронзировать, набросать,
набрызгать, навалить, навалять, наварить, навезти, навертеть, навести, навешать1,
навешать2, навить, навозить, наволочь, наворовать, наворожить, наворотить, наворочать,
наворошить, навыдумать, навязать, навялить, нагатить, нагладить, наглушить,
наглянцевать, нагнать2, нагнать3, нагнать4, наговорить, нагородить, наготовить,
нагофрировать, награбить, награвировать, награнить, награфить, нагрести, нагромоздить,
нагрызть, нагулять, надавать, надарить, надбавить, наддать, наделать, надергать, надеть,
надоить, надолбить, надрать, надубить, надуть, нажарить, нажать1, нажать2, нажечь,
нажить, назанимать, назвать2, наиграть, накапать, накатать, накатить, накачать, наквасить,
накидать, накипятить, наклеить2, наклепать, наковать, накоксовать, наколдовать,
наколотить, наколоть, наколупать, накомкать, накопать1, накопать2, накопить, накоптить,
накорчевать, накосить, накрасить, накрасть, накрахмалить, накроить, накропать,
накрошить, накрутить, накупить, накурить, накусать, накутать, налакировать, налепить,
налетать, налиновать, налитографировать, налить, наловить, наложить, 1, наломать,
налощить, налудить, налузгать, налущить, наляпать, намазать, намазюкать, намарать,
намариновать, намежевать, намельчить, наменять, намерить, намесить, намести, наметать,
намешать, намолотить, намолоть, наморить, наморозить, намочить, намыть, намять, нанести,
нанизать, наносить, наобещать, наострить, наоткрывать, напарить, напасти, напахать,
напаять, напеть, напечь, напилить, напихать, наплавить, наплескать, наплести, наплющить,
наполировать, наполоскать, наполосовать, наполоть, напомнить, напороть, напортить,
напророчить, напрыскать, напрясть, напутать, наработать, нарассказать, нарастить,
нарвать, нарезать, нарубать, нарубить, нарыть1, нарыть2, насадить1, насбивать, насверлить,
населить, насечь, насеять, насинить, насказать, наскоблить, наскрести, наслать, наследовать,
наслоить, насмолить, наснимать, насобирать, насовать, насоветовать, насоздавать, насолить,
насортировать, насосать, насочинить, наставить, настегать, настелить, настирать, настлать,
настричь, настрогать, настроить, настрочить, настругать, настряпать, настукать, насудачить,
насулить, насучить, насушить, насшибать, насыпать, натаскать, натащить, натаять,
натворить1, натворить,2, натеребить, натереть, натесать, натискать, наткать, натолкать,
натолочь, натомить, натопить, наторговать, наточить1, наточить2, натратить, натрепать,
натрещать, натрусить, натрясти, натушить, натыкать, наудить, наутюжить, нафабриковать,
нафантазировать, нафаршировать, наформовать, нахапать, нахватать, нацедить, начеканить,
начерпать, начертить, начесать, начинить1, начиркать, начистить, нашвырять, нашелушить,
нашептать, нашинковать, нашить, нашпиговать, наштамповать, наштопать, нащелкать,
нащепать, нащипать, наэкономить, недобрать, недоварить, недовернуть, недовесить,
недовыполнить, недовыработать, недовыручить, недовязать, недоглядеть, недоговорить,
недогрузить, недодать, недоделать, недодержать, недожарить, недожать1, недожать2,
недожечь, недоиспользовать, недолить, недомерить, недомолотить, недомолоть, недооценить,
недопаять, недопечь, недописать, недоплатить, недополучить, недоработать, недосеять,
недосказать, недослать, недослышать, недосмотреть, недосолить, недосы’пать, недотянуть,
недоучесть, обежать, обезболить, обезводить, обезгазить, обезжирить, обеззаразить,
обезлесить, обезлиствить, обезлюдить, обесплодить, обеспылить, обессмыслить, обессолить,
обесточить, обесцветить, обесценить, облечь2, обмежевать, обойти, объехать, объявить,
одолжить, окультурить, олицетворить, оплатить, основать, отбавить, отведать, отвезти,
отвесить, отдавать, откусить, отлить, отмечать, отнести, отпить, отплеснуть, отрезать,
отрубить, отсосать, отсыпать, оттаять, отхлебнуть, отцедить, отчерпнуть, парировать,
патентовать, патрулировать, перебежать, перебирать, перебрать, перевалить, переговорить,
передарить, передать1, переехать, перейти, перекусить, перелететь, переложить, перемахнуть,
переплыть, переползти, перепрыгнуть, перерасти, перескочить, переступить, пересыпать,
перехватить, перешагнуть, петь, писать, плескать, плеснуть, поведать, подать, подбавить,
подбросить2, подвалить, подварить, подвезти, подгрузить, поджарить, подзаработать,
подкинуть, подклеить, подколоть, подкопить, подкупить, подлить, подложить, подмесить,
подмешать, подмотать, поднакопить, поднести, подпустить, подрезать, подрубить, подрыть,
подсадить, подсеять, подсыпать, подтолочь, подтопить, подучить, подчеркивать, поесть,
пожевать, позаимствовать, поискать, поклевать, поколоть, покосить, покрошить, покрутить,
покушать, помнить, понабрать, понабросать, понавезти, понавести, понавешать1,
понавешать2, понавозить, понавязать, понагородить, понадавать, понаделать, понакидать,
понаклеить, понанести, понапихать, понаснимать, понасобирать, понасовать, понаставить,
понастроить, понатаскать, понатыкать, понахватать, понашить, понаштопать, понимать,
попомнить, попробовать, попросить, попытать, порезать, порицать, порубить, посбавить,
посбирать, посбить, посолить, посушить, посы’пать, потрясти, похлебать, почерпать,
почерпнуть, пошвырять, превозмочь, предварить, предвещать, предвосхитить,
предначертать, предотвратить, предугадать, предупредить, презреть, преодолеть, претерпеть,
прибавить, приберегать, приболтать, прибросить, приварить, привезти, привесить2,
приволочь, приготовить1, приготовить2, пригубить, придать, призанять, прикинуть,
прикопить, прикупить, прилить, примесить, примешать, примотать, принакопить, принести,
принять, припасти, прирезать, присадить, присеять, прислать, присыпать, притащить,
прихватить, проведать, проглядеть, проехать, пройти, промыслить, просить, проследить,
прочитать, развевать, разграничить, раздобыть, различить, рассказать, растаять, сварить,
свидетельствовать, связать, сигнализировать, слышать, смотреть, собрать1, сообщить,
спрашивать, спросить, стоить, сыпать, толковать, торговать, тормозить, трактовать,
требовать, трудить, трясти, тянуть1, убавить, удовлетворить, узнать, указать, уплатить,
услышать, утверждать, хватить, хлебнуть, хлопать, хотеть, черпнуть, читать, швырять,
шевелить



"
209,кому, dat, ," амнистия, ассистировать, аудиенция, безразличный, благо:, благоволить, благодарный,
важно, вдогонку, верный, вредный, годиться, длинный, долг, дорого’й, друг, желать,
заблагорассудится, записать, идти3, известный, интервью, интересный, каюк, консультация,
корм, короткий, купить, лгать, легко, льгота, мигать, мирволить, налгать, наследовать,
небезразличный, небезызвестный, небезынтересный, невидимый, неизвестный, неинтересный,
некролог, ненужный, необходимый, неповадно, непонятный, неприятный, несдобровать,
неугодный, неудобный, нужный, обелиск, обидный, опасный, опора, остаться, отвезти,
открыться, отложить, отнести, отослать, отправить, охота, памятка, памятный, пасовать2,
пенять, писать, письмо, подарок, поддержка, подойти, подотчетный, подходить, подходящий,
понятный, послание, потакать, преемник, прекословить, претить, привезти, привилегии,
пригодиться, признательный, принести, приятный, пройти, даром, протежировать, родной,
родня, сватать, свойственный, симпатичный, скидка, служба, тесный, трудный, тяжело,
удобно, удобный, узкий, усвоить, хвастаться, хороший, чужой, широкий, ясный"
210,кого с чем, acc, ,поздравить
211,кого-л. что-л где, acc, ,выгрузить
